{
  "schema_version": 1,
  "metric_id": "22222222-2222-4222-8222-222222222222",
  "user_id": "demo-user-1",
  "metric_type": "respiratory_rate",
  "acquisition_class": "recent_context",
  "value": 16.0,
  "unit": "count/min",
  "observed_at": "2026-07-18T08:10:00Z",
  "source": "apple_healthkit",
  "source_kind": "apple_healthkit",
  "source_name": "Demo Apple Watch",
  "source_bundle_id": "com.apple.health",
  "device_model": "Apple Watch",
  "simulated": false,
  "quality": null,
  "used_for_escalation": false
}
